{
  "repository_root": "C:\\Users\\richg\\eafix-modular",
  "excluded_directories": [
    ".git",
    "__pycache__",
    "node_modules",
    ".pytest_cache",
    ".mypy_cache",
    "htmlcov",
    "out",
    ".runs",
    ".state",
    ".coverage"
  ],
  "excluded_files": [
    ".DS_Store",
    "Thumbs.db",
    "*.pyc",
    "*.pyo",
    "*.pyd",
    "*.tmp",
    "*.bak"
  ],
  "assign_root_directory_id": false,
  "directory_identity_mechanism": {
    "mechanism": "sidecar_anchor_file",
    "anchor_filename": ".dir_id",
    "anchor_required": true
  },
  "file_identity_mechanism": {
    "mechanism": "registry_assigned",
    "rename_required": false
  },
  "physical_id_patterns": {
    "id_length": 20,
    "file_id_pattern": "^1\\d{19}$",
    "directory_id_pattern": "^2\\d{19}$"
  }
}
